{
  "$schema": "../../../schemas/git-ape/metadata/v1.json",
  "schemaVersion": "1.0",
  "deploymentId": "stack-storage-eastus-001",
  "timestamp": "2026-05-06T08:25:00Z",
  "user": "arnaudlh@example.com",
  "status": "succeeded",
  "statusReason": null,
  "type": "new",
  "mode": "interactive",
  "scope": "subscription",
  "region": "eastus",
  "project": "demo",
  "environment": "dev",
  "deployMethod": "stack",
  "resourceGroup": "rg-demo-dev-eastus",
  "resourceGroups": ["rg-demo-dev-eastus"],
  "resources": [
    {
      "type": "Microsoft.Resources/resourceGroups",
      "name": "rg-demo-dev-eastus",
      "status": "succeeded"
    },
    {
      "type": "Microsoft.Storage/storageAccounts",
      "name": "stdemodev8k3m",
      "status": "succeeded"
    }
  ],
  "resourceCount": 2,
  "resourceTypes": [
    "Microsoft.Resources/resourceGroups",
    "Microsoft.Storage/storageAccounts"
  ],
  "estimatedMonthlyCost": 4.32,
  "tags": {
    "Environment": "dev",
    "Project": "demo",
    "ManagedBy": "git-ape-agent",
    "CreatedDate": "2026-05-06"
  },
  "createdBy": "arnaudlh"
}
